name,ring,quadrant,isNew,description
Cloud Carbon Footprint,Trial,Tools,FALSE,"<p><strong><a href=""https://www.cloudcarbonfootprint.org/"">Cloud Carbon Footprint</a></strong> (CCF) is an open-source tool that uses cloud APIs to provide visualizations of estimated carbon emissions based on usage across AWS, GCP and Azure. The Thoughtworks team has <a href=""https://www.thoughtworks.com/clients/Bringing-green-cloud-optimization-to-a-green-energy-business"">successfully used the tool</a> with several organizations, including energy technology companies, retailers, digital service providers and companies that use AI. Cloud platform providers realize that it's important to help their customers understand the carbon impact of using their services, so they've begun to build similar functionality themselves. Because CCF is cloud agnostic, it allows users to view energy usage and carbon emissions for multiple cloud providers in one place, while translating carbon footprints into real-world impact such as flights or trees planted.</p>

<p>In recent releases, CCF has begun to include Google Cloud and AWS-sourced optimization recommendations alongside potential energy and CO2 savings, as well as to support more cloud instance types such as GPU instances. Given the traction the tool has received and the continued addition of new features, we feel confident moving it to Trial.</p>"
Conftest,Trial,Tools,FALSE,"<p><strong><a href=""https://github.com/open-policy-agent/conftest"">Conftest</a></strong> is a tool for writing tests against structured configuration data. It relies on the <a href=""https://www.openpolicyagent.org/docs/latest/policy-language/#what-is-rego"">Rego language</a> from <a href=""/radar/tools/open-policy-agent-opa"">Open Policy Agent</a> to write tests for <a href=""/radar/platforms/kubernetes"">Kubernetes</a> configurations, <a href=""/radar/platforms/tekton"">Tekton</a> pipeline definitions or even <a href=""/radar/tools/terraform"">Terraform</a> plans. We've had great experiences with Conftest — and its shallow learning curve. With fast feedback from tests, our teams iterate quickly and safely on configuration changes to Kubernetes.</p>"
kube-score,Trial,Tools,TRUE,"<p><strong><a href=""https://github.com/zegl/kube-score"">kube-score</a></strong> is a tool that does static code analysis of your Kubernetes object definitions. The output is a list of recommendations for what you can improve to make your application more secure and resilient. It has a list of <a href=""https://github.com/zegl/kube-score/blob/master/README_CHECKS.md"">predefined checks</a> which includes best practices such as running containers with non-root privileges and correctly specifying resource limits. It's been around for some time, and we've used it in a few projects as part of a CD pipeline for Kubernetes manifests. A major drawback of kube-score is that you can't add custom policies. We typically supplement it with tools like <a href=""/radar/tools/conftest"">Conftest</a> in these cases.</p>"
Lighthouse,Trial,Tools,FALSE,"<p><strong><a href=""https://developers.google.com/web/tools/lighthouse/"">Lighthouse</a></strong> is a tool written by Google to assess web applications and web pages, collecting performance metrics and insights on good development practices. We've long advocated for <a href=""/radar/techniques/performance-testing-as-a-first-class-citizen"">performance testing as a first-class citizen</a>, and the additions to Lighthouse that we mentioned five years ago certainly helped with that. Our thinking around <a href=""/radar/techniques/architectural-fitness-function"">architectural fitness functions</a> created strong motivation for tools such as Lighthouse to be run in build pipelines. With the introduction of <a href=""https://github.com/GoogleChrome/lighthouse-ci"">Lighthouse CI</a>, it has become easier than ever to include Lighthouse in pipelines managed by <a href=""https://github.com/GoogleChrome/lighthouse-ci/blob/main/docs/getting-started.md#configure-your-ci-provider"">various tools</a>.</p>"
Metaflow,Trial,Tools,TRUE,"<p><strong><a href=""https://github.com/Netflix/metaflow"">Metaflow</a></strong> is a user-friendly Python library and back-end service that helps data scientists and engineers build and manage production-ready data processing, ML training and inference workflows. Metaflow provides Python APIs that structure the code as a directed graph of steps. Each step can be decorated with flexible configurations such as the required compute and storage resources. Code and data artifacts for each step's run (aka task) are stored and can be retrieved either for future runs or the next steps in the flow, enabling you to recover from errors, repeat runs and track  versions of models and their dependencies across multiple runs.</p>

<p>The value proposition of Metaflow is the simplicity of its idiomatic Python library: it fully integrates with the build and run-time infrastructure to enable running data engineering and science tasks in local and scaled production environments. At the time of writing, Metaflow is heavily integrated with AWS services such as S3 for its data store service and step functions for orchestration. Metaflow supports R in addition to Python. Its core features are open sourced.</p>

<p>If you're building and deploying your production ML and data-processing pipelines on AWS, Metaflow is a lightweight full-stack alternative framework to more complex platforms such as <a href=""/radar/tools/mlflow"">MLflow</a>.</p>"
Micrometer,Trial,Tools,TRUE,"<p><strong><a href=""https://micrometer.io/"">Micrometer</a></strong> is a platform-agnostic library for metrics instrumentation on the JVM that supports Graphite, New Relic, CloudWatch and many other integrations. We've found that Micrometer has benefited both library authors and teams: library authors can include metrics instrumentation code in their libraries without needing to support each and every metrics system that their users are using;  and teams can support many different metrics on back-end registries which enables organizations to collect metrics in a consistent way.</p>"
NUKE,Trial,Tools,TRUE,"<p><strong><a href=""https://nuke.build/"">NUKE</a></strong> is a build system for .NET and an alternative to either the traditional MSBuild or <a href=""https://cakebuild.net/"">Cake</a> and <a href=""https://fake.build/"">Fake</a> which we've featured previously in the Radar. NUKE represents build instructions as a C# DSL, making it easy to learn and with good IDE support. In our experience, NUKE made it really simple to build automation for .NET projects. We like the accurate static code checks and hints. We also like that we can use any NuGet package seamlessly and that the automation code can be compiled to avoid problems at runtime. NUKE isn't new, but its novel approach — using a C# DSL — and our positive overall experience prompted us to include it here.</p>"
Pactflow,Trial,Tools,FALSE,"<p>We've used <a href=""https://github.com/pact-foundation"">Pact</a> for contract testing long enough to see some of the complexity that comes with scale. Some of our teams have successfully used <strong><a href=""https://pactflow.io/"">Pactflow</a></strong> to reduce that friction. Pactflow runs both as software as a service and as an on-prem deployment with the same features as the SaaS offering, and it adds improved usability, security and auditing on top of the open-source Pact Broker offering. We've been pleased with our use so far and are happy to see continued effort to remove some of the overhead of managing contract testing at scale.</p>"
Podman,Trial,Tools,FALSE,"<p>As an alternative to <a href=""/radar/platforms/docker"">Docker</a>, <strong><a href=""https://github.com/containers/podman"">Podman</a></strong> has been validated by many of our teams. Podman introduces a daemonless engine for managing and running containers which is an interesting approach in comparison to what Docker does. Additionally, Podman can be easily run as a normal user <a href=""/radar/platforms/rootless-containers"">without requiring root privileges</a>, which reduces the attack surface. By using either <a href=""https://opencontainers.org/"">Open Container Initiative</a> (OCI) images built by <a href=""https://github.com/containers/buildah"">Buildah</a> or Docker images, Podman can be adapted to most container use cases. Apart from some compatibility issues with macOS, our team has had generally good experiences with Podman on Linux distributions.</p>"
Sourcegraph,Trial,Tools,FALSE,"<p>In our previous Radar, we featured two tools that search and replace code using an abstract syntax tree (AST) representation, <a href=""/radar/tools/comby"">Comby</a> and <strong><a href=""https://about.sourcegraph.com/"">Sourcegraph</a></strong>. Although they share some similarities, they also differ in several ways. Sourcegraph is a commercial tool (with a 10-user free tier). It's particularly suited for searching, navigating or cross-referencing in large codebases, with an emphasis on an interactive developer experience. In contrast, Comby is a lightweight open-source command-line tool for automating repetitive tasks. Because Sourcegraph is a hosted service, it also has the ability to continuously monitor code bases and send alerts when a match occurs. Now that we've gained more experience with Sourcegraph, we decided to move it into the Trial ring to reflect our positive experience — which doesn't mean that Sourcegraph is better than Comby. Each tool focuses on a different niche.</p>"
Syft,Trial,Tools,TRUE,"<p>One of the key elements of improving ""supply chain security"" is using a <a href=""/radar/techniques/software-bill-of-materials"">Software Bill of Materials (SBOM)</a>, which is why publishing an SBOM along with the software artifact is increasingly important. <strong><a href=""https://github.com/anchore/syft"">Syft</a></strong> is a CLI tool and Go library for generating an SBOM from container images and file systems. It can generate the SBOM output in multiple formats, including JSON, <a href=""/radar/platforms/cyclonedx"">CycloneDX</a> and SPDX. The SBOM output of Syft can be used by <a href=""/radar/tools/grype"">Grype</a> for vulnerability scanning. One way to publish the generated SBOM along with the image is to add it as an attestation using <a href=""/radar/tools/cosign"">Cosign</a>. This allows consumers of the image to verify the SBOM and to use it for further analysis.</p>"
Volta,Trial,Tools,TRUE,"<p>When working on multiple JavaScript codebases at the same time, it's often necessary to use different versions of Node and other JavaScript tools. On developer machines, these tools are usually installed in the user account or the machine itself, which means a solution is needed to switch between multiple installations. For Node itself there's nvm, but we want to highlight <strong><a href=""https://volta.sh/"">Volta</a></strong> as an alternative that we're seeing in use with our teams. Volta has several advantages over using nvm: it can manage other JavaScript tools such as Yarn; it also has the notion of pinning a version of the toolchain on a project basis, which means that developers can simply use the tools in a given code directory without having to worry about manually switching between tool versions — Volta simply uses shims in the path to select the pinned version. Written in Rust, Volta is fast and ships as a single binary without dependencies.</p>"
Web Test Runner,Trial,Tools,TRUE,"<p><strong><a href=""https://modern-web.dev/docs/test-runner/overview/"">Web Test Runner</a></strong> is a package within the <a href=""https://modern-web.dev/"">Modern Web</a> project, which provides several high-quality tools for modern web development with support for web standards like ES Modules. Web Test Runner is a test runner for web applications. One of its advantages compared to existing test runners is that it runs tests in the browser (which could be headless). It supports multiple browser launchers — including <a href=""/radar/languages-and-frameworks/puppeteer"">Puppeteer</a>, <a href=""/radar/tools/playwright"">Playwright</a>, and Selenium — and uses Mocha by default for the test framework. The tests run pretty fast, and we like that we can open a browser window with devtools when debugging. Web Test Runner internally uses <a href=""https://modern-web.dev/docs/dev-server/overview/"">Web Dev Server</a> which allows us to leverage its great plugin API for adding customized plugins for our test suite. Modern Web tools look like a very promising developer toolchain, and we're already using it in a few projects.</p>"
CDKTF,Assess,Tools,TRUE,"<p>By now many organizations have created sprawling landscapes of services in the cloud. Of course, this is only possible when using <a href=""/radar/techniques/infrastructure-as-code"">infrastructure as code</a> and mature tooling. We still like <a href=""/radar/tools/terraform"">Terraform</a>, not the least because of its rich and growing ecosystem. However, the lack of abstractions in HCL, Terraform's default configuration language, effectively creates a glass ceiling. Using <a href=""/radar/tools/terragrunt"">Terragrunt</a> pushes that up a bit further, but more and more often our teams find themselves longing for the abstractions afforded by modern programming languages. <a href=""https://www.terraform.io/cdktf""><strong>Cloud Development Kit for Terraform (CDKTF)</strong></a>, which resulted from a collaboration between AWS's <a href=""/radar/platforms/aws-cloud-development-kit"">CDK</a> team and Hashicorp, makes it possible for teams to use several programming languages, including TypeScript and Java, to define and provision infrastructure. With this approach it follows the lead of <a href=""/radar/platforms/pulumi"">Pulumi</a> while remaining in the Terraform ecosystem. We've had good experiences with CDKTF but have decided to keep it in the Assess ring until it moves out of beta.</p>"
Chrome Recorder panel,Assess,Tools,TRUE,"<p><strong><a href=""https://developer.chrome.com/docs/devtools/recorder/"">Chrome Recorder panel</a></strong> is a preview feature in Google Chrome 97 that allows for simple record and playback of user journeys. While this definitely isn't a new idea, the way in which it is integrated into Chrome allows for quick creation, editing and running of scripts. The panel also integrates nicely with the performance panel, which makes getting repeated consistent feedback on page performance easier. While record/playback style testing always needs to be used with care in order to avoid brittle tests, we think this preview feature is worth assessing, especially if you're already using the Chrome Performance panel to measure your pages.</p>"
Excalidraw,Assess,Tools,TRUE,"<p><strong><a href=""https://excalidraw.com/"">Excalidraw</a></strong> is a simple but powerful online drawing tool that our teams enjoy using. Sometimes teams just need a quick picture instead of a formal diagram, for remote teams Excalidraw provides a quick way to create and share diagrams. Our teams also like the ""lo-fi"" look of the diagrams it can produce, which is reminiscent of the whiteboard diagrams they would have produced when co-located. One caveat: you need to pay attention to the default security — at the time of writing, anyone who has the link can see the diagram. A paid-for version provides further authentication.</p>"
GitHub Codespaces,Assess,Tools,TRUE,"<p><strong><a href=""https://github.com/features/codespaces"">GitHub Codespaces</a></strong> allows developers to create <a href=""/radar/techniques/development-environments-in-the-cloud"">development environments in the cloud</a> and access them through an IDE as though the environment were local. GitHub isn't the first company to implement this idea; we previously blipped about <a href=""/radar/tools/gitpod"">Gitpod</a>. We like that Codespaces allows environments to be standardized by using dotfiles configuration, making it quicker to onboard new team members, and that they offer VMs with up to 32 cores and 64GB memory. These VMs can be spun up in under ten seconds, potentially offering environments more powerful than a developer laptop.</p>"
GoReleaser,Assess,Tools,TRUE,"<p><a href=""https://github.com/goreleaser/goreleaser""><strong>GoReleaser</strong></a> is a tool that automates the process of building and releasing a Go project for different architectures via multiple repositories and channels, a common need for Go projects targeting different platforms. You run the tool either from your local machine or via CI, with the tool available via several CI services thus minimizing set-up and maintenance. GoReleaser takes care of build, packaging, publishing and announcement of each release and supports different combinations of package format, package repository and source control. Although it's been around for a few years, we're surprised that more teams are not using it. If you're regularly releasing a Go codebase, this tool is worth assessing.</p>"
Grype,Assess,Tools,TRUE,"<p>Securing the software supply chain has become a commonplace concern among delivery teams, a concern that is reflected by the growing number of new tools in this space. <strong><a href=""https://github.com/anchore/grype"">Grype</a></strong> is a new lightweight vulnerability scanning tool for Docker and OCI images. It can be installed as a binary, can scan images before they're pushed to a registry, and it doesn't require a Docker daemon to run on your build agents. Grype comes from the same team that is behind <a href=""/radar/tools/syft"">Syft</a>, which generates <a href=""/radar/techniques/software-bill-of-materials"">SBOMs</a> in various formats from container images. Grype can consume the SBOM output of Syft to scan for vulnerabilities.</p>"
Infracost,Assess,Tools,TRUE,"<p>One often-cited advantage of moving to the cloud is transparency around infrastructure spend. In our experience, this is often not the case. Teams don't always think about the decisions they make around infrastructure in terms of financial cost which is why we previously blipped about <a href=""/radar/techniques/run-cost-as-architecture-fitness-function"">run cost as architecture fitness function</a>. We're intrigued by the release of a new tool called <strong><a href=""https://infracost.io/"">Infracost</a></strong> which aims to make cost trade-offs visible in Terraform pull requests. It's open-source software and available for macOS, Linux, Windows and Docker and supports pricing for AWS, GCP and Microsoft Azure out of the box. It also provides a public API that can be queried for current cost data. Our teams are excited by its potential, especially when it comes to gaining better cost visibility in the IDE.</p>"
jc,Assess,Tools,TRUE,"<p>In our previous Radar, we placed <a href=""/radar/tools/modern-unix-commands"">modern Unix commands</a> in Assess. One of the commands featured in that collection of tools was jq, effectively a sed for JSON. <strong><a href=""https://kellyjonbrazil.github.io/jc/docs/"">jc</a></strong> performs a related task: it takes the output of common Unix commands and parses the output into JSON. The two commands together provide a bridge between the Unix CLI world and the raft of libraries and tools that operate on JSON. When writing <em>simple</em> scripts, for example, for software deployment or gathering troubleshooting information, having the myriad of different Unix command output formats mapped into well-defined JSON can save a lot of time and effort. As with jq, you need to make sure the command is available. It can be installed from many of the well-known package repositories.</p>"
skopeo,Assess,Tools,TRUE,"<p><strong><a href=""https://github.com/containers/skopeo"">skopeo</a></strong> is a command line utility that performs various operations on container images and image repositories. It doesn't require a user to be root to do most of its operations nor does it require a daemon to be running. It's a useful part of a CI pipeline; we've used it to copy images from one registry to another as we promote the images. It's better than doing a pull and a push as we don't need to store the images locally. It's not a new tool, but it's useful enough and underutilized that we felt it's worth calling it out.</p>"
SQLFluff,Assess,Tools,TRUE,"<p>While linting is an ancient practice in the software world, it's had slower adoption in the data world. <strong><a href=""https://docs.sqlfluff.com/en/stable/"">SQLFluff</a></strong> is a cross-dialect SQL linter written in Python that ships with a simple command line interface (CLI), making it easy to incorporate into a CI/CD pipeline. If you're comfortable with the default conventions, then SQLFluff works without any additional configuration after installing it and will enforce a strongly opinionated set of formatting standards; setting your own conventions involves adding a configuration dotfile. The CLI can automatically fix certain classes of violations that involve formatting concerns like whitespace or uppercasing of keywords. SQLFluff is still new, but we're excited to see SQL getting some attention in the linting world.</p>"
Terraform Validator,Assess,Tools,TRUE,"<p>Organizations that have adopted <a href=""/radar/techniques/infrastructure-as-code"">infrastructure as code</a> and self-service infrastructure platforms are looking for ways to give teams a maximum of autonomy while still enforcing good security practices and organizational policies. We've highlighted <a href=""/radar/tools/tfsec"">tfsec</a> before and are moving it into the Adopt category in this Radar. For teams working on GCP, <a href=""https://github.com/GoogleCloudPlatform/terraform-validator""><strong>Terraform Validator</strong></a> could be an option when creating a policy library, a set of constraints that are checked against Terraform configurations.</p>"
Typesense,Assess,Tools,TRUE,"<p><strong><a href=""https://github.com/typesense/typesense"">Typesense</a></strong> is a fast, typo-tolerant text search engine. For use cases with large volumes of data, Elasticsearch might still be a good option as it provides a horizontally scalable disk-based search solution. However, if you're building a latency-sensitive search application with a search index size that can fit in memory, Typesense is a powerful alternative and another option to evaluate alongside tools such as <a href=""/radar/platforms/meilisearch"">Meilisearch</a>.</p>"
SwiftUI,Adopt,languages-and-frameworks,FALSE,"<p>When Apple introduced <strong><a href=""https://developer.apple.com/xcode/swiftui/"">SwiftUI</a></strong> a few years ago, it was a big step forward for implementing user interfaces on all kinds of devices made by Apple. From the beginning, we liked the declarative, code-centric approach and the reactive programming model provided by <a href=""/radar/languages-and-frameworks/combine"">Combine</a>. We did notice, though, that writing a lot of view tests, which you still need with a model—view—viewmodel (MVVM) pattern, was not really sensible with the XCUITest automation framework provided by Apple. This gap has been closed by <a href=""/radar/languages-and-frameworks/viewinspector"">ViewInspector</a>. A final hurdle was the minimum OS version required. At the time of release, only the very latest versions of iOS and macOS could run applications written with SwiftUI, but because of Apple’s regular cadence of updates, SwiftUI apps can now run on practically all versions of macOS and iOS that receive security updates.</p>"
Testcontainers,Adopt,languages-and-frameworks,FALSE,"<p>We've had enough experience with <strong><a href=""https://www.testcontainers.org/"">Testcontainers</a></strong> that we think it's a useful default option for creating a reliable environment for running tests. It's a library, ported to <a href=""https://github.com/testcontainers"">multiple languages</a>, that Dockerizes common test dependencies — including various types of databases, queuing technologies, cloud services and UI testing dependencies like web browsers — with the ability to run custom Dockerfiles when needed. It works well with test frameworks like JUnit, is flexible enough to let users manage the container lifecycle and advanced networking and quickly sets up an integrated test environment. Our teams have consistently found this library of programmable, lightweight and disposable containers to make functional tests more reliable.</p>"
Bob,Trial,languages-and-frameworks,TRUE,"<p>When building an app with React Native you sometimes find yourself having to create your own modules. For example, we've encountered this need when building a UI component library for a React Native app. Creating such a module project isn't straightforward, and our teams report success using <strong><a href=""https://github.com/callstack/react-native-builder-bob"">Bob</a></strong> to automate this task. Bob provides a CLI to create the scaffolding for different targets. The scaffolding is not limited to core functionality but, optionally, can include example code, linters, build pipeline configuration and other features.</p>"
Flutter-Unity widget,Trial,languages-and-frameworks,TRUE,"<p>Flutter is increasingly popular for building cross-platform mobile apps, and Unity is great for building AR/VR experiences. A key piece in the puzzle for integrating Unity and Flutter is the <strong><a href=""https://github.com/juicycleff/flutter-unity-view-widget"">Flutter-Unity widget</a></strong>, which allows embedding Unity apps inside Flutter widgets. One of the key capabilities the widget offers is bi-directional communication between Flutter and Unity. We've found its performance to be pretty good as well, and we're looking forward to leveraging Unity in more Flutter apps.</p>"
