name,ring,quadrant,isNew,description
Kotest,Trial,languages-and-frameworks,FALSE,"<p><strong><a href=""https://kotest.io/"">Kotest</a></strong> (previously KotlinTest) is a stand-alone testing tool for the <a href=""/radar/languages-and-frameworks/kotlin"">Kotlin</a> ecosystem that is continuing to gain traction within our teams across various Kotlin implementations — native, JVM or JavaScript. Key advantages are that it offers a variety of testing styles in order to structure the test suites and that it comes with a comprehensive set of matchers, which allow for expressive tests in an elegant internal DSL. In addition to its support for <a href=""/radar/techniques/property-based-unit-testing"">property-based testing</a> — a technique we've highlighted previously in the Radar — our teams like the solid IntelliJ plugin and the growing community of support.</p>"
Swift Package Manager,Trial,languages-and-frameworks,TRUE,"<p>Some programming languages, especially newer ones, have a package and dependency management solution built in. When it was introduced in 2014, Swift didn't come with a package manager, and so the macOS and iOS developer community simply kept using CocoaPods and <a href=""/radar/tools/carthage"">Carthage</a>, the third-party solutions that had been created for Objective-C. A couple of years later <strong><a href=""https://github.com/apple/swift-package-manager"">Swift Package Manager</a></strong> (SwiftPM) was started as an official Apple open-source project, and it then took another few  years before Apple added support for it to Xcode. Even at that point, though, many development teams continued to use CocoaPods and Carthage, mostly because many packages were simply not available via SwiftPM. Now that most packages can be included via SwiftPM and processes have been further streamlined for both creators and consumers of packages, our teams are increasingly relying on SwiftPM.</p>"
Vowpal Wabbit,Trial,languages-and-frameworks,FALSE,"<p><strong><a href=""https://vowpalwabbit.org/"">Vowpal Wabbit</a></strong> is a general-purpose machine-learning library. Originally created at Yahoo! Research over a decade ago, Vowpal Wabbit continues to implement new algorithms in reinforcement learning. We want to highlight <a href=""https://vowpalwabbit.org/blog/vowpalwabbit-9.0.0.html"">Vowpal Wabbit 9.0</a>, a major release after six years, and encourage you to plan the <a href=""https://vowpalwabbit.org/docs/vowpal_wabbit/python/latest/reference/python_8110_900_migration_guide.html"">migration</a> as it has several usability improvements, new reductions and bug fixes.</p>"
Android Gradle plugin - Kotlin DSL,Assess,languages-and-frameworks,TRUE,"<p><strong>Android Gradle plugin Kotlin DSL</strong> added support for Kotlin Script as an alternative to Groovy for Gradle build scripts. The goal of replacing Groovy with Kotlin is to provide better support for refactoring and simpler editing in IDEs as well as ultimately to produce code that is easier to read and maintain. For teams already using Kotlin it also means working on the build in a familiar language. We had a team with an at least seven-year-old 450-line build script <a href=""https://developer.android.com/studio/build/migrate-to-kts"">migrate</a> within a few days. If you have large or complex gradle build scripts, then it's worth assessing whether Kotlin Script will produce better outcomes for your teams.</p>"
Azure Bicep,Assess,languages-and-frameworks,TRUE,"<p>For those who prefer a more natural language than JSON for infrastructure code, <strong><a href=""https://docs.microsoft.com/en-us/azure/azure-resource-manager/bicep/overview?tabs=bicep"">Azure Bicep</a></strong> is a domain-specific language (DSL) that uses a declarative syntax. It supports reusable parameterized templates for modular resource definitions. A <a href=""https://marketplace.visualstudio.com/items?itemName=ms-azuretools.vscode-bicep"">Visual Studio Code extension</a> provides instant type-safety, intellisense and syntax checking, and the compiler allows bidirectional transpilation to and from ARM templates. Bicep's resource-oriented DSL and native integration with the Azure ecosystem make it a compelling choice for Azure infrastructure development.</p>"
Capacitor,Assess,languages-and-frameworks,TRUE,"<p>We've been debating the merits of cross-platform mobile development tools for nearly as long as we've been publishing the Technology Radar. We first noted a new generation of tools in 2011 when blipping about <a href=""/radar/tools/cross-mobile-platforms"">cross-mobile platforms</a>. Although we were skeptical of them at first, these tools have been perfected and widely adopted over the years. And nobody can debate the enduring popularity and usefulness of <a href=""/radar/languages-and-frameworks/react-native"">React Native</a>. <strong><a href=""https://capacitorjs.com/"">Capacitor</a></strong> is the latest generation of a line of tools starting with PhoneGap, then renamed to <a href=""/radar/platforms/phonegap-apache-cordova"">Apache Cordova</a>. Capacitor is a complete rewrite from Ionic that embraces the <a href=""/radar/techniques/progressive-web-applications"">progressive web app</a> style for stand-alone applications. So far, our developers like that they can address web, iOS and Android applications with a single code base and that they can manage the native platforms separately with access to the native APIs when necessary. Capacitor offers an alternative to React Native, which has many years of cross-platform experience behind it.</p>"
Java 17,Assess,languages-and-frameworks,TRUE,"<p>We don't routinely feature new versions of languages, but we wanted to highlight the new long-term support (LTS) version of Java, version 17. While there are promising new features, such as the preview of <a href=""https://openjdk.java.net/jeps/406"">pattern matching</a>, it's the switch to the new LTS process that should interest many organizations. We recommend organizations assess new releases of Java as and when they become available, making sure they adopt new features and versions as appropriate. Surprisingly many organizations do not routinely adopt newer versions of languages even though regular updates help keep things small and manageable. Hopefully the new LTS process, alongside organizations moving to regular updates, will help avoid the ""too expensive to update"" trap that ends with production software running on an end-of-life version of Java.</p>"
Jetpack Glance,Assess,languages-and-frameworks,TRUE,"<p>Android 12 brought significant changes to app widgets that have improved the user and developer experience. For writing regular Android apps, we've expressed our preference for <a href=""/radar/languages-and-frameworks/jetpack-compose"">Jetpack Compose</a> as a modern way of building native user interfaces. Now, with <strong><a href=""https://developer.android.com/jetpack/androidx/releases/glance"">Jetpack Glance</a></strong>, which is built on top of the Compose runtime, developers can use similar declarative Kotlin APIs for writing widgets. Recently, Glance has been <a href=""https://android-developers.googleblog.com/2022/01/announcing-glance-tiles-for-wear-os.html"">extended</a> to support Tiles for Wear OS.</p>"
Jetpack Media3,Assess,languages-and-frameworks,TRUE,"<p>Android today has several media APIs: Jetpack Media, also known as MediaCompat, Jetpack Media2 and ExoPlayer. Unfortunately, these libraries were developed independently, with different goals but overlapping functionality. Android developers not only had to choose which library to use, they also had to contend with writing adaptors or other connecting code when features from multiple APIs were needed. <a href=""https://developer.android.com/jetpack/androidx/releases/media3""><strong>Jetpack Media3</strong></a> is an effort, currently in early access, to create a new API that takes common areas of functionality from the existing APIs — including UI, playback and media session handling — combining them into a merged and refined API. The player interface from ExoPlayer has also been updated, enhanced and streamlined to act as the common player interface for Media3.</p>"
MistQL,Assess,languages-and-frameworks,TRUE,"<p><strong><a href=""https://github.com/evinism/mistql"">MistQL</a></strong> is a small domain-specific language for performing computations on JSON-like structures. Originally built for handcrafted feature extraction of machine-learning models on the frontend, MistQL currently supports a JavaScript implementation for browsers and a Python implementation for server-side use cases. We quite like its clean composable functional syntax, and we encourage you to assess it based on your needs.</p>"
npm workspaces,Assess,languages-and-frameworks,TRUE,"<p>While many tools support multipackage development in the node.js world, npm 7 adds direct support with the addition of <strong><a href=""https://docs.npmjs.com/cli/v8/using-npm/workspaces"">npm workspaces</a></strong>. Managing related packages together facilitates development, allowing you, for example, to store multiple related libraries in a single repo. With npm workspaces, once you add a configuration in a top-level package.json file to refer to one or more nested package.json files, commands like <code>npm install</code> work across multiple packages, symlinking the dependent source packages into the root node_modules directory. Other npm commands are also now workspace aware, allowing you, for example, to execute <code>npm run</code> and <code>npm test</code> commands across multiple packages with a single command. Having that flexibility out of the box decreases the need for some teams to reach for another package manager.</p>"
Remix,Assess,languages-and-frameworks,TRUE,"<p>We witnessed the migration from server-side rendering website to single-page application in the browser, now the pendulum of web development seems to swing back to the middle. <strong><a href=""https://remix.run/"">Remix</a></strong> is one such example. It's a full-stack JavaScript framework. It provides fast page loads by leveraging distributed systems and native browsers instead of clumsy static builds. It has made some optimizations on nested routing and page loading, which makes page rendering seem especially fast. Many people will compare Remix with <a href=""/radar/languages-and-frameworks/next-js"">Next.js</a>, which is similarly positioned. We're glad to see such frameworks cleverly combining the browser run time with the server run time to provide a better user experience.</p>"
ShedLock,Assess,languages-and-frameworks,TRUE,"<p>Executing a scheduled task once and only once in a cluster of distributed processors is a relatively common requirement. For example, the situation might arise when ingesting a batch of data, sending a notification or performing some regular cleanup activity. But this is a notoriously difficult problem. How does a group of processes cooperate reliably over laggy and less reliable networks? Some kind of locking mechanism is required to coordinate actions across the cluster. Fortunately, a variety of distributed stores can implement a lock. Systems like <a href=""https://zookeeper.apache.org/"">ZooKeeper</a> and <a href=""/radar/tools/consul"">Consul</a> as well as databases such as DynamoDB or <a href=""/radar/platforms/couchbase"">Couchbase</a> have the necessary underlying mechanisms to manage consensus across the cluster. <strong><a href=""https://github.com/lukas-krecan/ShedLock"">ShedLock</a></strong> is a small library for taking advantage of these providers in your own Java code, if you're looking to implement your own scheduled tasks. It provides an API for acquiring and releasing locks as well as connectors to a wide variety of lock providers. If you're writing your own distributed tasks but don't want to take on the complexity of an entire orchestration platform like <a href=""/radar/platforms/kubernetes"">Kubernetes</a>, ShedLock is worth a look.</p>"
SpiceDB,Assess,languages-and-frameworks,TRUE,"<p><strong><a href=""https://github.com/authzed/spicedb"">SpiceDB</a></strong> is a database system, inspired by Google's <a href=""https://research.google/pubs/pub48190"">Zanzibar</a>, for managing application permissions. With SpiceDB, you create a schema to model the permissions requirements and use the <a href=""https://docs.authzed.com/reference/api#client-libraries"">client library</a> to apply the schema to one of the <a href=""https://docs.authzed.com/spicedb/selecting-a-datastore"">supported databases</a>, insert data and query to efficiently answer questions like ""Does this user have access to this resource?"" or even the inverse ""What are all the resources this user has access to?"" We usually advocate separating the authorization policies from code, but SpiceDB takes it a step further by separating data from the policy and storing it as a graph to efficiently answer authorization queries. Because of this separation, you have to ensure that the changes in your application's primary data store are reflected in SpiceDB. Among other Zanzibar-inspired implementations, we find SpiceDB to be an interesting framework to assess for your authorization needs.</p>"
sqlc,Assess,languages-and-frameworks,TRUE,"<p><strong><a href=""https://github.com/kyleconroy/sqlc"">sqlc</a></strong> is a compiler that generates type-safe idiomatic Go code from SQL. Unlike other approaches based on object-relational mapping (ORM), you continue to write plain SQL for your needs. Once invoked, sqlc checks the correctness of the SQL and generates performant Go code, which can be directly called from the rest of the application. With stable support for both PostgreSQL and MySQL, sqlc is worth a look, and we encourage you to assess it.</p>"
The Composable Architecture,Assess,languages-and-frameworks,TRUE,"<p>Developing apps for iOS has become more streamlined over time, and <a href=""https://www.thoughtworks.com/radar/languages-and-frameworks/swiftui"">SwiftUI</a> moving into Adopt is a sign of that. Going beyond the general nature of SwiftUI and other common frameworks, <a href=""https://github.com/pointfreeco/swift-composable-architecture#the-composable-architecture""><strong>The Composable Architecture</strong></a> (TCA) is both a library and an architectural style for building apps. It was designed over the course of a series of videos, and the authors state that they had composition, testing and ergonomics in mind, building on a foundation of ideas from The Elm Architecture and Redux. As expected, the narrow scope and opinionatedness is both a strength and a weakness of TCA. We feel that teams who don't have a lot of expertise in writing iOS apps, which are often teams who may be looking after multiple related codebases with different tech stacks, stand to benefit the most from using an opinionated framework like TCA, and we like the opinions expressed in TCA.</p>"
WebAssembly,Assess,languages-and-frameworks,FALSE,"<p><strong><a href=""http://webassembly.org/"">WebAssembly</a></strong> (WASM) is the W3C standard that provides capabilities of executing code in the browser. Supported by all major browsers and backward compatible, it's a binary compilation format designed to run in the browser at near native speeds. It opens up the range of languages you can use to write front-end functionality, with early focus on C, C++ and Rust, and it's also an <a href=""https://llvm.org/"">LLVM compilation</a> target. When run in the sandbox, it can interact with JavaScript and shares the same permissions and security model. Portability and security are key capabilities that will enable most platforms, including mobile and IoT.</p>"
Zig,Assess,languages-and-frameworks,TRUE,"<p><strong><a href=""https://ziglang.org/"">Zig</a></strong> is a new language that shares many attributes with C but with stronger typing, easier memory allocation, support for namespacing and a host of other features. Its syntax, however, is reminiscent of JavaScript rather than C, which some may hold against it. Zig's aim is to provide a very simple language with straightforward compilation that minimizes side-effects and delivers predictable, easy-to-trace execution. Zig also provides simplified access to LLVM's <a href=""https://llvm.org/"">cross-compilation capability</a>. Some of our developers have found this feature so viable, they're using Zig as a cross-compiler even though they aren't writing Zig code. Zig is a novel language and worth looking into  for applications where C is being considered or already in use as well as for low-level systems applications that require explicit memory manipulation.</p>"