name,ring,quadrant,isNew,description
Four key metrics,Adopt,Techniques,FALSE,"<p>To measure software delivery performance, more and more organizations are defaulting to the <strong>four key metrics</strong> as defined by the <a href=""https://www.devops-research.com/"">DORA research</a> program: change lead time, deployment frequency, mean time to restore (MTTR) and change fail percentage. This research and its statistical analysis have shown a clear link between high-delivery performance and these metrics; they provide a great leading indicator for how a delivery organization as a whole is doing.</p>

<p>We're still big proponents of these metrics, but we've also learned some lessons. We're still observing misguided approaches with tools that help teams measure these metrics based purely on their continuous delivery (CD) pipelines. In particular when it comes to the stability metrics (MTTR and change fail percentage), CD pipeline data alone doesn't provide enough information to determine what a deployment failure with real user impact is. Stability metrics only make sense if they include data about real incidents that degrade service for the users.</p>

<p>We recommend always to keep in mind the ultimate intention behind a measurement and use it to reflect and learn. For example, before spending weeks building up sophisticated dashboard tooling, consider just regularly taking the <a href=""https://www.devops-research.com/quickcheck.html"">DORA quick check</a> in team retrospectives. This gives the team the opportunity to reflect on which <a href=""https://www.devops-research.com/research.html#capabilities"">capabilities</a> they could work on to improve their metrics, which can be much more effective than overdetailed out-of-the-box tooling. Keep in mind that these four key metrics originated out of the organization-level research of high-performing teams, and the use of these metrics at a team level should be a way to reflect on their own behaviors, not just another set of metrics to add to the dashboard.</p>"
Single team remote wall,Adopt,Techniques,FALSE,"<p>A <strong>single team remote wall</strong> is a simple technique to reintroduce the team wall virtually. We recommend that distributed teams adopt this approach; one of the things we hear from teams who moved to remote working is that they miss having the physical team wall. This was a single place where all the various story cards, tasks, status and progress could be displayed, acting as an information radiator and hub for the team. The wall acted as an integration point with the actual data being stored in different systems. As teams have become remote, they've had to revert to looking into the individual source systems and getting an ""at a glance"" view of a project has become very difficult. While there might be some overhead in keeping this up-to-date, we feel the benefits to the team are worth it. For some teams, updating the physical wall formed part of the daily ""ceremonies"" the team did together, and the same can be done with a remote wall.</p>"
Data mesh,Trial,Techniques,FALSE,"<p><a href=""https://martinfowler.com/articles/data-monolith-to-mesh.html""><strong>Data mesh</strong></a> is a <em>decentralized</em> organizational and technical approach in sharing, accessing and managing data for analytics and ML. Its objective is to create a <em>sociotechnical</em> approach that scales out getting value from data as the organization's complexity grows and as the use cases for data proliferate and the sources of data diversify. Essentially, it creates a <em>responsible</em> data-sharing model that is in step with organizational growth and continuous change. In our experience, interest in the application of data mesh has grown tremendously. The approach has inspired many organizations to embrace its adoption and technology providers to repurpose their existing technologies for a mesh deployment. Despite the great interest and growing experience in data mesh, its implementations face high cost of integration. Moreover, its adoption remains limited to sections of larger organizations and technology vendors are distracting the organizations from the hard <em>socio</em> aspects of data mesh — decentralized data ownership and a federated governance operating model.</p>

<p>These ideas are explored in <em><a href=""https://www.amazon.com/Data-Mesh-Delivering-Data-Driven-Value/dp/1492092398"">Data Mesh, Delivering Data-Driven Value at Scale</a></em>, which guides practitioners, architects, technical leaders and decision makers on their journeys from traditional big data architecture to data mesh. It provides a complete introduction to data mesh principles and its constituents; it covers how to design a data mesh architecture, guide and execute a data mesh strategy and navigate organizational design to a decentralized data ownership model. The goal of the book is to create a TRUE framework for deeper conversations and lead to the next phase in maturity of data mesh.</p>"
Definition of production readiness,Trial,Techniques,TRUE,"<p>In an organization that practices the ""you build it, you run it"" principle, a <strong>definition of production readiness</strong> (DPR) is a useful technique to support teams in assessing and preparing the operational readiness of new services. Implemented as a checklist or a template, a DPR gives teams guidance on what to think about and consider before they bring a new service into production. While DPRs do not define specific service-level objectives (SLOs) to fulfill (those would be hard to define one-size-fits-all), they remind teams what categories of SLOs to think of, what organizational standards to comply with and what documentation is required. DPRs provide a source of input that teams turn into respective product-specific requirements around, for example, observability and reliability, to feed into their product backlogs.</p>

<p>DPRs are closely related to Google's concept of a <a href=""https://sre.google/sre-book/evolving-sre-engagement-model/#:%7E:text=The%20most%20typical,of%20a%20service"">production readiness review (PRR)</a>. In organizations that are too small to have a dedicated site reliability engineering team, or who are concerned that a review board process could negatively impact a team's flow to go live, having a DPR can at least provide some guidance and document the agreed-upon criteria for the organization. For highly critical new services, extra scrutiny on fulfilling the DPR can be added via a PRR when needed.</p>"
Documentation quadrants,Trial,Techniques,TRUE,"<p>Writing good documentation is an overlooked aspect of software development that is often left to the last minute and done in a haphazard way. Some of our teams have found <strong><a href=""https://documentation.divio.com/"">documentation quadrants</a></strong> a handy way to ensure the right artifacts are being produced. This technique classifies artifacts along two axes: The first axis relates to the nature of the information, practical or theoretical; the second axis describes the context in which the artifact is used, studying or working. This defines four quadrants in which artifacts such as tutorials, how-to guides or reference pages can be placed and understood. This classification system not only ensures that critical artifacts aren't overlooked but also guides the presentation of the content. We've found this particularly useful for creating onboarding documentation that brings developers up to speed quickly when they join a new team.</p>"
Rethinking remote standups,Trial,Techniques,TRUE,"<p>The term <em>standup</em> originated from the idea of standing up during this daily sync meeting, with the goal of making it short. It's a common principle many teams try to abide by in their standups: keep it crisp and to the point. But we're now seeing teams challenge that principle and <strong>rethinking remote standups</strong>. When co-located, there are lots of opportunities during the rest of the day to sync up with each other spontaneously, as a complement to the short standup. Remotely, some of our teams are now experimenting with a longer meeting format, similar to what the folks at Honeycomb call a “<a href=""https://www.honeycomb.io/blog/standup-meetings-are-dead/"">meandering team sync</a>.”</p>

<p>It's not about getting rid of a daily sync altogether; we still find that very important and valuable, especially in a remote setup. Instead, it's about extending the time blocked in everybody's calendars for the daily sync to up to an hour, and use it in a way that makes some of the other team meetings obsolete and brings the team closer together. Activities can still include the well-tried walkthrough of the team board but are then extended by more detailed clarification discussions, quick decisions, and taking time to socialize. The technique is considered successful if it reduces the overall meeting load and improves team bonding.</p>"
Server-driven UI,Trial,Techniques,TRUE,"<p>When putting together a new volume of the Radar, we're often overcome by a sense of déjà vu, and the technique of <strong>server-driven UI</strong> sparks a particularly strong case with the advent of frameworks that allow mobile developers to take advantage of faster change cycles while not falling foul of an app store's policies around revalidation of the mobile app itself. We've blipped about this before from the perspective of enabling mobile development to <a href=""/radar/techniques/micro-frontends-for-mobile"">scale across teams</a>. Server-driven UI separates the rendering into a generic container in the mobile app while the structure and data for each view is provided by the server. This means that changes that once required a round trip to an app store can now be accomplished via simple changes to the responses the server sends. Note, we're not recommending this approach for all UI development, indeed we've experienced some horrendous, overly configurable messes, but with the backing of behemoths such as AirBnB and Lyft, we suspect it's not only us at Thoughtworks getting tired of <a href=""/radar/techniques/spa-by-default"">everything being done client side</a>. Watch this space.</p>"
Software Bill of Materials,Trial,Techniques,FALSE,"<p>With continued pressure to keep systems secure and no reduction in the general threat landscape, a machine-readable <strong>Software Bill of Materials</strong> (SBOM) may help teams stay on top of security problems in the libraries that they rely on. The recent <a href=""https://en.wikipedia.org/wiki/Log4Shell"">Log4Shell</a> zero-day remote exploit was critical and widespread, and if teams had had an SBOM ready, it could have been scanned for and fixed quickly. We've now had production experience using SBOMs on projects ranging from small companies to large multinationals and even government departments, and we're convinced they provide a benefit. Tools such as <a href=""/radar/tools/syft"">Syft</a> make it easy to use an SBOM for vulnerability detection.</p>"
Tactical forking,Trial,Techniques,TRUE,"<p><strong><a href=""https://faustodelatog.wordpress.com/2020/10/16/tactical-forking/"">Tactical forking</a></strong> is a technique that can assist with restructuring or migrating from monolithic codebases to microservices. Specifically, this technique offers one possible alternative to the more common approach of fully modularizing the codebase first, which in many circumstances can take a very long time or be very challenging to achieve. With tactical forking a team can create a new fork of the codebase and use that to address and extract one particular concern or area while deleting the unnecessary code. Use of this technique would likely be just one part of a longer-term plan for the overall monolith.</p>"
Team cognitive load,Trial,Techniques,FALSE,"<p>A system's architecture mimics an organizational structure and its communication. It's not big news that we should be intentional about how teams interact — see, for instance, the <a href=""/radar/techniques/inverse-conway-maneuver"">Inverse Conway Maneuver</a>. Team interaction is one of the variables for how fast and how easily teams can deliver value to their customers. We were happy to find a way to measure these interactions; we used the <a href=""https://teamtopologies.com/book"">Team Topologies</a> author's <a href=""https://github.com/TeamTopologies/Team-Cognitive-Load-Assessment"">assessment</a> which gives you an understanding of how easy or difficult the teams find it to build, test and maintain their services. By measuring <strong>team cognitive load</strong>, we could better advise our clients on how to change their teams' structure and evolve their interactions.</p>"
Transitional architecture,Trial,Techniques,TRUE,"<p>A <strong><a href=""https://martinfowler.com/articles/patterns-legacy-displacement/transitional-architecture.html"">transitional architecture</a></strong> is a useful practice used when replacing legacy systems. Much like scaffolding might be built, reconfigured and finally removed during construction or renovation of a building, you often need interim architectural steps during legacy displacement. Transitional architectures will be removed or replaced later on, but they're not just throwaway work given the important role they play in reducing risk and allowing a difficult problem to be broken into smaller steps. Thus they help with avoiding the trap of defaulting to a ""big bang"" legacy replacement approach, because you cannot make smaller interim steps line up with a final architectural vision. Care is needed to make sure the architectural ""scaffolding"" is eventually removed, lest it just become technical debt later on.</p>"
CUPID,Assess,Techniques,TRUE,"<p>How do you approach writing good code? How do you judge if you've written good code? As software developers, we're always looking for catchy rules, principles and patterns that we can use to share a language and values with each other when it comes to writing simple, easy-to-change code.</p>

<p>Daniel Terhorst-North has recently made a new attempt at creating such a checklist for good code. He argues that instead of sticking to a set of rules like <a href=""https://en.wikipedia.org/wiki/SOLID"">SOLID</a>, using a set of properties to aim for is more generally applicable. He came up with what he calls the <strong><a href=""https://dannorth.net/2022/02/10/cupid-for-joyful-coding/"">CUPID</a></strong> properties to describe what we should strive for to achieve ""joyful"" code: Code should be composable, follow the Unix philosophy and be predictable, idiomatic and domain based.</p>"
Inclusive design,Assess,Techniques,TRUE,"<p>We recommend organizations assess <a href=""https://www.microsoft.com/design/inclusive/""><strong>inclusive design</strong></a> as a way of making sure accessibility is treated as a first-class requirement. All too often requirements around accessibility and inclusivity are ignored until just before, if not just after, the release of software. The cheapest and simplest way to accommodate these requirements, while also providing early feedback to teams, is to incorporate them fully into the development process. In the past, we've highlighted techniques that perform a ""shift-left"" for security and cross-functional requirements; one perspective on this technique is that it achieves the same goal for accessibility.</p>"
Operator pattern for nonclustered resources,Assess,Techniques,FALSE,"<p>We're continuing to see increasing use of the <a href=""/radar/tools/kubernetes-operators"">Kubernetes Operator</a> pattern for purposes other than managing applications deployed on the cluster. Using the <strong>Operator pattern for nonclustered resources</strong> takes advantage of custom resource definitions and the event-driven scheduling mechanism implemented in the Kubernetes control plane to manage activities that are related to yet outside of the cluster. This technique builds on the idea of <a href=""/radar/techniques/kube-managed-cloud-services"">Kube-managed cloud services</a> and extends it to other activities, such as continuous deployment or reacting to changes in external repositories. One advantage of this technique over a purpose-built tool is that it opens up a wide range of tools that either come with Kubernetes or are part of the wider ecosystem. You can use commands such as diff, dry-run or apply to interact with the operator's custom resources. Kube's scheduling mechanism makes development easier by eliminating the need to orchestrate activities in the proper order. Open-source tools such as <a href=""/radar/tools/crossplane"">Crossplane</a>, <a href=""https://fluxcd.io/"">Flux</a> and <a href=""/radar/platforms/argo-cd"">Argo CD</a> take advantage of this technique, and we expect to see more of these emerge over time. Although these tools have their use cases, we're also starting to see the inevitable misuse and overuse of this technique and need to repeat some old advice: Just because you <em>can</em> do something with a tool doesn't mean you <em>should</em>. Be sure to rule out simpler, conventional approaches before creating a custom resource definition and taking on the complexity that comes with this approach.</p>"
Service mesh without sidecar,Assess,Techniques,TRUE,"<p><a href=""/radar/techniques/service-mesh"">Service mesh</a> is usually implemented as a reverse-proxy process, aka sidecar, deployed alongside each service instance. Although these sidecars are lightweight processes, the overall cost and operational complexity of adopting service mesh increases with every new instance of the service requiring another sidecar. However, with the advancements in <a href=""/radar/platforms/ebpf"">eBPF</a>, we're observing a new <a href=""https://isovalent.com/blog/post/2021-12-08-ebpf-servicemesh""><strong>service mesh without sidecar</strong></a> approach where the functionalities of the mesh are safely pushed down to the OS kernel, thereby enabling services in the same node to communicate transparently via sockets without the need of additional proxies. You can try this with <a href=""https://github.com/cilium/cilium-service-mesh-beta"">Cilium service mesh</a> and simplify the deployment from one proxy-per-service to one proxy-per-node. We're intrigued by the capabilities of eBPF and find this evolution of service mesh to be important to assess.</p>"
SLSA,Assess,Techniques,TRUE,"<p>As software continues to grow in complexity, the threat vector of software dependencies becomes increasingly challenging to guard against. The recent Log4J vulnerability showed how difficult it can be to even <em>know</em> those dependencies — many companies who didn't use Log4J directly were unknowingly vulnerable simply because other software in their ecosystem relied on it. Supply chain Levels for Software Artifacts, or <strong><a href=""https://slsa.dev"">SLSA</a></strong> (pronounced ""salsa""), is a consortium-curated set of guidance for organizations to protect against supply chain attacks, evolved from internal guidance Google has been using for years. We appreciate that SLSA doesn't promise a ""silver bullet,"" tools-only approach to securing the supply chain but instead provides a checklist of concrete threats and practices along a maturity model. The <a href=""https://slsa.dev/spec/v0.1/threats"">threat model</a> is easy to follow with real-world examples of attacks, and the <a href=""https://slsa.dev/spec/v0.1/requirements"">requirements</a> provide guidance to help organizations prioritize actions based on levels of increasing robustness to improve their supply chain security posture. We think SLSA provides applicable advice and look forward to more organizations learning from it.</p>"
The streaming data warehouse,Assess,Techniques,TRUE,"<p>The need to respond quickly to customer insights has driven increasing adoption of event-driven architectures and stream processing. Frameworks such as <a href=""/radar/platforms/apache-spark"">Spark</a>, <a href=""/radar/platforms/apache-flink"">Flink</a> or <a href=""/radar/platforms/kafka-streams"">Kafka Streams</a> offer a paradigm where simple event consumers and producers can cooperate in complex networks to deliver real-time insights. But this programming style takes time and effort to master and when implemented as single-point applications, it lacks interoperability. Making stream processing work universally on a large scale can require a significant engineering investment. Now, a new crop of tools is emerging that offers the benefits of stream processing to a wider, established group of developers who are comfortable using SQL to implement analytics. Standardizing on SQL as the universal streaming language lowers the barrier for implementing streaming data applications. Tools like <a href=""/radar/languages-and-frameworks/ksqldb"">ksqlDB</a> and <a href=""/radar/platforms/materialize"">Materialize</a> help transform these separate applications into unified platforms. Taken together, a collection of SQL-based streaming applications across an enterprise might constitute a <strong>streaming data warehouse</strong>.</p>"
TinyML,Assess,Techniques,TRUE,"<p>Until recently, executing a machine-learning (ML) model was seen as computationally expensive and in some cases required special-purpose hardware. While creating the models still broadly sits within this classification, they can be created in a way that allows them to be run on small, low-cost and low-power consumption devices. This technique, called <strong><a href=""https://towardsdatascience.com/an-introduction-to-tinyml-4617f314aa79"">TinyML</a></strong>, has opened up the possibility of running ML models in situations many might assume infeasible. For example, on battery-powered devices, or in disconnected environments with limited or patchy connectivity, the model can be run locally without prohibitive cost. If you've been considering using ML but thought it unrealistic because of compute or network constraints, then this technique is worth assessing.</p>"
Azure Data Factory for orchestration,Hold,Techniques,FALSE,"<p>For organizations using Azure as their primary cloud provider, <a href=""https://azure.microsoft.com/en-us/services/data-factory/"">Azure Data Factory</a> is currently the default for orchestrating data-processing pipelines. It supports data ingestion, copying data from and to different storage types on prem or on Azure and executing transformation logic. Although we've had adequate experience with Azure Data Factory for simple migrations of data stores from on prem to the cloud, we discourage the use of <strong>Azure Data Factory for orchestration</strong> of complex data-processing pipelines and workflows. We've had some success with Azure Data Factory when it's used primarily to move data between systems. For more complex data pipelines, it still has its challenges, including poor debuggability and error reporting; limited observability as Azure Data Factory logging capabilities don't integrate with other products such as Azure Data Lake Storage or Databricks, making it difficult to get an end-to-end observability in place; and availability of data source-triggering mechanisms only to certain regions. At this time, we encourage using other open-source orchestration tools (e.g., <a href=""/radar/tools/airflow"">Airflow</a>) for complex data pipelines and limiting Azure Data Factory for data copying or snapshotting. Our teams continue to use Data Factory to move and extract data, but for larger operations we recommend other, more well-rounded workflow tools.</p>"
Miscellaneous platform teams,Hold,Techniques,TRUE,"<p>We previously featured <a href=""/radar/techniques/platform-engineering-product-teams"">platform engineering product teams</a> in Adopt as a good way for internal platform teams to operate, thus enabling delivery teams to self-service deploy and operate systems with reduced lead time and stack complexity. Unfortunately we're seeing the ""platform team"" label applied to teams dedicated to projects that don't have clear outcomes or a well-defined set of customers. As a result, these <strong>miscellaneous platform teams</strong>, as we call them, struggle to deliver due to high cognitive loads and a lack of clearly aligned priorities as they're dealing with a miscellaneous collection of unrelated systems. They effectively become just another general support team for things that don't fit or that are unwanted elsewhere. We continue to believe platform engineering product teams focused around a clear and well-defined (internal) product offer a better set of outcomes.</p>"
