name,ring,quadrant,isNew,description
Production data in test environments,Hold,Techniques,FALSE,"<p>We continue to perceive <strong>production data in test environments</strong> as an area for concern. Firstly, many examples of this have resulted in reputational damage, for example, where an incorrect alert has been sent from a test system to an entire client population. Secondly, the level of security, specifically around protection of private data, tends to be less for test systems. There is little point in having elaborate controls around access to production data if that data is copied to a test database that can be accessed by every developer and QA. Although you <em>can</em> obfuscate the data, this tends to be applied only to specific fields, for example, credit card numbers. Finally, copying production data to test systems can break privacy laws, for example, where test systems are hosted or accessed from a different country or region. This last scenario is especially problematic with complex cloud deployments. Fake data is a safer approach, and tools exist to help in its creation. We do recognize there are reasons for <em>specific</em> elements of production data to be copied, for example, in the reproduction of bugs or for training of specific ML models. Here our advice is to proceed with caution.</p>"
SPA by default,Hold,Techniques,TRUE,"<p>We generally avoid putting blips in Hold when we consider that advice too obvious, including blindly following an architectural style without paying attention to trade-offs. However, the sheer prevalence of teams choosing a single-page application (SPA) by default when they need a website has us concerned that people aren't even recognizing SPAs as an architectural style to begin with, instead immediately jumping into framework selection. SPAs incur complexity that simply doesn't exist with traditional server-based websites: search engine optimization, browser history management, web analytics, first page load time, etc. That complexity is often warranted for user experience reasons, and tooling continues to evolve to make those concerns easier to address (although the churn in the React community around state management hints at how hard it can be to get a generally applicable solution). Too often, though, we don't see teams making that trade-off analysis, blindly accepting the complexity of <strong>SPAs by default</strong> even when the business needs don't justify it. Indeed, we've started to notice that many newer developers aren't even aware of an alternative approach, as they've spent their entire career in a framework like React. We believe that many websites will benefit from the simplicity of server-side logic, and we're encouraged by techniques like <a href=""/radar/techniques/hotwire"">Hotwire</a> that help close the gap on user experience.</p>"
Azure DevOps,Trial,Platforms,FALSE,"<p>As the <strong><a href=""https://azure.microsoft.com/en-us/services/devops/"">Azure DevOps</a></strong> ecosystem keeps growing, our teams are using it more with success. These services contain a set of managed services, including hosted Git repos, build and deployment pipelines, automated testing tooling, backlog management tooling and artifact repository. We've seen our teams gaining experience in using this platform with good results, which means Azure DevOps is maturing. We particularly like its flexibility; it allows you to use the services you want even if they're from different providers. For instance, you could use an external Git repository while still using the Azure DevOps pipeline services. Our teams are especially excited about <a href=""https://azure.microsoft.com/en-us/services/devops/pipelines/"">Azure DevOps Pipelines</a>. As the ecosystem matures, we're seeing an uptick in onboarding teams that are already on the Azure stack as it easily integrates with the rest of the Microsoft world.</p>"
Azure Pipeline templates,Trial,Platforms,TRUE,"<p><strong><a href=""https://docs.microsoft.com/en-us/azure/devops/pipelines/process/templates?view=azure-devops"">Azure Pipeline templates</a></strong> allow you to remove duplication in your Azure Pipeline definition through two mechanisms. With ""includes"" templates, you can reference a template such that it will expand inline like a parameterized C++ macro, allowing a simple way of factoring out common configuration across stages, jobs and steps. With ""extends"" templates, you can define an outer shell with common pipeline configuration, and with the <a href=""https://docs.microsoft.com/en-us/azure/devops/pipelines/process/approvals?view=azure-devops&tabs=check-pass#required-template"">required template approval</a>, you can fail the build if the pipeline doesn't extend certain templates, preventing malicious attacks against the pipeline configuration itself. Along with <a href=""/radar/platforms/circleci"">CircleCI</a> Orbs and the newer <a href=""/radar/platforms/reusable-workflows-in-github-actions"">GitHub Actions Reusable Workflows</a>, Azure Pipeline templates are part of the trend of creating modularity in pipeline design across multiple platforms, and several of our teams have been happy using them.</p>"
CircleCI,Trial,Platforms,FALSE,"<p>Many of our teams choose <strong><a href=""http://circleci.com/"">CircleCI</a></strong> for their continuous integration needs, and they appreciate its ability to run complex pipelines efficiently. The CircleCI developers continue to add new features with CircleCI, now in version 3.0. <a href=""https://circleci.com/docs/2.0/concepts/#orbs"">Orbs</a> and <a href=""https://circleci.com/docs/2.0/executor-types/"">executors</a> were called out by our teams as being particularly useful. Orbs are reusable snippets of code that automate repeated processes, speed up project setup and make it easy to integrate with third-party tools. The wide variety of executor types provides flexibility to set up jobs in Docker, Linux, macOS or Windows VMs.</p>"
Couchbase,Trial,Platforms,FALSE,"<p>When we originally blipped <strong><a href=""https://www.couchbase.com/"">Couchbase</a></strong> in 2013, it was seen primarily as a persistent cache that evolved from a merger of <a href=""https://github.com/membase"">Membase</a> and <a href=""https://couchdb.apache.org/"">CouchDB</a>. Since then, it has undergone steady improvement and an ecosystem of related tools and commercial offerings has grown up around it. Among the additions to the product suite are Couchbase Mobile and the Couchbase Sync Gateway. These features work together to keep persistent data on edge devices up-to-date even when the device is offline for periods of time due to intermittent connectivity. As these devices proliferate, we see increasing need for embedded persistence that continues to work whether or not the device happens to be connected. Recently, one of our teams evaluated Couchbase for its offline sync capability and found that this off-the-shelf capability saved them considerable effort that they otherwise would have had to invest themselves.</p>"
eBPF,Trial,Platforms,FALSE,"<p>For several years now, the Linux kernel has included the extended Berkeley Packet Filter (<strong><a href=""https://ebpf.io/"">eBPF</a></strong>), a virtual machine that provides the ability to attach filters to particular sockets. But eBPF goes far beyond packet filtering and allows custom scripts to be triggered at various points within the kernel with very little overhead. Although this technology isn't new, it's now coming into its own with the increasing use of microservices deployed as orchestrated containers. Kubernetes and service mesh technology such as <a href=""/radar/platforms/istio"">Istio</a> are commonly used, and they employ sidecars to implement control functionality. With new tools — <a href=""https://github.com/solo-io/bumblebee"">Bumblebee</a> in particular makes building, running and distributing eBPF programs much easier — eBPF can be seen as an alternative to the traditional sidecar. A maintainer of <a href=""/radar/tools/cilium"">Cilium</a>, a tool in this space, has even proclaimed the <a href=""https://isovalent.com/blog/post/2021-12-08-ebpf-servicemesh"">demise of the sidecar</a>. An approach based on eBPF reduces some overhead in performance and operation that comes with sidecars, but it doesn't support common features such as SSL termination.</p>"
GitHub Actions,Trial,Platforms,FALSE,"<p><strong><a href=""https://docs.github.com/en/actions"">GitHub Actions</a></strong> has grown considerably last year. It has proven that it can take on more complex workflows and call other actions in composite actions among other things. It still has some shortcomings, though, such as its inability to re-trigger a single job of a workflow. Although the ecosystem in the <a href=""https://github.com/marketplace?type=actions"">GitHub Marketplace</a> has its obvious advantages, giving third-party GitHub Actions access to your build pipeline risks sharing secrets in insecure ways (we recommend following GitHub's advice on <a href=""https://docs.github.com/en/actions/security-guides/security-hardening-for-github-actions"">security hardening</a>). However, the convenience of creating your build workflow directly in GitHub next to your source code combined with the ability to run GitHub Actions locally using open-source tools such as <a href=""https://github.com/nektos/act"">act</a> is a compelling option that has facilitated setup and onboarding of our teams.</p>"
GitLab CI/CD,Trial,Platforms,TRUE,"<p>If you're using <a href=""https://gitlab.com/"">GitLab</a> to manage your software delivery, you should also look at <strong><a href=""https://docs.gitlab.com/ee/ci/"">GitLab CI/CD</a></strong> for your continuous integration and continuous delivery needs. We've found it especially useful when used with on-premise GitLab and self-hosted runners, as this combination gets around authorization headaches often caused by using a cloud-based solution. Self-hosted runners can be fully configured for your purposes with the right OS and dependencies installed, and as a result pipelines can run much faster than using a cloud-provisioned runner that needs to be configured each time.</p>

<p>Apart from the basic build, test and deploy pipeline, GitLab's product supports Services, Auto Devops and ChatOps among other advanced features. Services are useful in running Docker services such as Postgres or <a href=""/radar/languages-and-frameworks/testcontainers"">Testcontainer</a> linked to a job for integration and end-to-end testing. Auto Devops creates pipelines with zero configuration which is very useful for teams that are new to continuous delivery or for organizations with many repositories that would otherwise need to create many pipelines manually.</p>"
Google BigQuery ML,Trial,Platforms,FALSE,"<p>Since we last blipped about <strong><a href=""https://cloud.google.com/bigquery-ml/docs"">Google BigQuery ML</a></strong>, more sophisticated models such as Deep Neural Networks and AutoML Tables have been added by connecting BigQuery ML with TensorFlow and Vertex AI as its backend. BigQuery has also introduced support for time series forecasting. One of our concerns previously was <a href=""/radar/techniques/explainability-as-a-first-class-model-selection-criterion"">explainability</a>. Earlier this year, <a href=""https://cloud.google.com/bigquery-ml/docs/reference/standard-sql/bigqueryml-syntax-xai-overview"">BigQuery Explainable AI</a> was announced for general availability, taking a step in addressing this. We can also export BigQuery ML models to Cloud Storage as a Tensorflow SavedModel and use them for online prediction. There remain trade-offs like ease of ""continuous delivery for machine learning"" but with its low barrier to entry, BigQuery ML remains an attractive option, particularly when the data already resides in BigQuery.</p>"
Google Cloud Dataflow,Trial,Platforms,FALSE,"<p><strong><a href=""https://cloud.google.com/dataflow/"">Google Cloud Dataflow</a></strong> is a cloud-based data-processing service for both batch and real-time data-streaming applications. Our teams are using Dataflow to create processing pipelines for integrating, preparing and analyzing large data sets, with <a href=""https://beam.apache.org/"">Apache Beam</a>'s unified programming model on top to ease manageability. We first featured Dataflow in 2018, and its stability, performance and rich feature set make us confident to move it to Trial in this edition of the Radar.</p>"
Reusable workflows in Github Actions,Trial,Platforms,TRUE,"<p>We've seen increased interest in <a href=""/radar/platforms/github-actions"">GitHub Actions</a> since we first blipped it two Radars ago. With the release of <a href=""https://docs.github.com/en/actions/using-workflows/reusing-workflows"">reusable workflows</a>, GitHub continues to evolve the product in a way that addresses some of its early shortcomings. <strong>Reusable workflows in Github Actions</strong> bring modularity to pipeline design, allowing parameterized reuse even across repositories (as long as the workflow repository is public). They support explicit passing of confidential values as secrets and can pass outputs to the calling job. With a few lines of YAML, GitHub Actions now gives you the type of flexibility you see with <a href=""/radar/platforms/circleci"">CircleCI</a> Orbs or <a href=""/radar/platforms/azure-pipeline-templates"">Azure Pipeline Templates</a>, but without having to leave GitHub as a platform.</p>"
Sealed Secrets,Trial,Platforms,FALSE,"<p><a href=""/radar/platforms/kubernetes"">Kubernetes</a> natively supports a key-value object known as a secret. However, by default, Kubernetes secrets aren't really secret. They're handled separately from other key-value data so that precautions or access control can be applied separately. There is support for encrypting secrets before they are stored in <a href=""https://etcd.io/"">etcd</a>, but the secrets start out as plain text fields in configuration files. <strong><a href=""https://github.com/bitnami-labs/sealed-secrets"">Sealed Secrets</a></strong> is a combination operator and command-line utility that uses asymmetric keys to encrypt secrets so that they can only be decrypted by the controller in the cluster. This process ensures that the secrets won't be compromised while they sit in the configuration files that define a Kubernetes deployment. Once encrypted, these files can be safely shared or stored alongside other deployment artifacts.</p>"
VerneMQ,Trial,Platforms,TRUE,"<p><strong><a href=""https://github.com/vernemq/vernemq"">VerneMQ</a></strong> is an open-source, high-performance, distributed MQTT broker. We've blipped other MQTT brokers in the past like <a href=""/radar/platforms/mosquitto"">Mosquitto</a> and <a href=""/radar/platforms/emq"">EMQ</a>. Like EMQ and RabbitMQ, VerneMQ is also based on Erlang/OTP which makes it highly scalable. It scales horizontally and vertically on commodity hardware to support a high number of concurrent publishers and consumers while maintaining low latency and fault tolerance. In our internal benchmarks, we've been able to achieve a few million concurrent connections in a single cluster. While it's not new, we've used it in production for some time now, and it has worked well for us.</p>"
actions-runner-controller,Assess,Platforms,TRUE,"<p><strong><a href=""https://github.com/actions-runner-controller/actions-runner-controller"">actions-runner-controller</a></strong> is a Kubernetes <a href=""https://kubernetes.io/docs/concepts/architecture/controller/"">controller</a> that operates <a href=""https://docs.github.com/en/actions/hosting-your-own-runners"">self-hosted runners</a> for <a href=""/radar/platforms/github-actions"">GitHub Actions</a> on your Kubernetes cluster. With this tool you create a runner resource on Kubernetes, and it will run and operate the self-hosted runner. Self-hosted runners are helpful in scenarios where the job that your GitHub Actions runs needs to access resources that are either not accessible to GitHub cloud runners or have specific operating system and environmental requirements that are different from what GitHub provides. In those cases where you have a Kubernetes cluster, you can run your self-hosted runners as a Kubernetes pod, with the ability to scale up or down hooking into GitHub webhook events. actions-controller-runner is lightweight and scalable.</p>"
Apache Iceberg,Assess,Platforms,TRUE,"<p><strong><a href=""https://iceberg.apache.org/"">Apache Iceberg</a></strong> is an open table format for very large analytic data sets. Iceberg supports modern analytical data operations such as record-level insert, update, delete, <a href=""https://iceberg.apache.org/docs/latest/spark-queries/#time-travel"">time-travel queries</a>, ACID transactions, <a href=""https://iceberg.apache.org/docs/latest/partitioning/#icebergs-hidden-partitioning"">hidden partitioning</a> and <a href=""https://iceberg.apache.org/docs/latest/evolution/"">full schema evolution</a>. It supports multiple underlying file storage formats such as <a href=""https://parquet.apache.org/"">Apache Parquet</a>, <a href=""https://orc.apache.org/"">Apache ORC</a> and <a href=""https://avro.apache.org/docs/1.2.0/"">Apache Avro</a>. Many data-processing engines support Apache Iceberg, including SQL engines such as <a href=""https://www.dremio.com/"">Dremio</a> and <a href=""https://trino.io/"">Trino</a> as well as (structured) streaming engines such as <a href=""https://spark.apache.org/"">Apache Spark</a> and <a href=""https://flink.apache.org/"">Apache Flink</a>.</p>

<p>Apache Iceberg falls in the same category as <a href=""https://delta.io/"">Delta Lake</a> and <a href=""https://hudi.apache.org/"">Apache Hudi</a>. They all more or less support similar features, but each differs in the underlying implementations and detailed feature lists. Iceberg is an independent format and is not native to any specific processing engine, hence it's supported by an increasing number of platforms, including <a href=""https://docs.aws.amazon.com/athena/latest/ug/querying-iceberg.html"">AWS Athena</a> and <a href=""https://www.snowflake.com/"">Snowflake</a>. For the same reason, Apache Iceberg, unlike native formats such as Delta Lake, may not benefit from optimizations when used with Spark.</p>"
Blueboat,Assess,Platforms,TRUE,"<p><strong><a href=""https://github.com/losfair/blueboat"">Blueboat</a></strong> is a multitenant platform for serverless web applications. It leverages the popular V8 JavaScript engine and implements commonly used web application libraries natively in <a href=""/radar/languages-and-frameworks/rust"">Rust</a> for security and performance. You can think of Blueboat as an alternative to <a href=""/radar/platforms/cloudflare-workers"">CloudFlare Workers</a> or <a href=""https://deno.com/deploy"">Deno Deploy</a> but with an important distinction — you have to operate and manage the underlying infrastructure. That said, we recommend you carefully assess Blueboat for your on-prem serverless needs.</p>"
Cloudflare Pages,Assess,Platforms,TRUE,"<p>When <a href=""/radar/platforms/cloudflare-workers"">Cloudflare Workers</a> was released, we highlighted it as an early function as a service (FaaS) for edge computing with an interesting implementation. The release of <strong><a href=""https://pages.cloudflare.com/"">Cloudflare Pages</a></strong> last April didn't feel as noteworthy, because Pages is just one in a class of many Git-backed site-hosting solutions. It did have continuous previews, a useful feature not found in most alternatives. Now, though, Cloudflare has more tightly <a href=""https://blog.cloudflare.com/cloudflare-pages-goes-full-stack/"">integrated Workers and Pages</a>, creating a fully integrated <a href=""/radar/techniques/jamstack"">Jamstack</a> solution running on the CDN. The inclusion of a key-value store and a strongly consistent coordination primitive further enhance the attractiveness of the new version of Cloudflare Pages.</p>"
Colima,Assess,Platforms,TRUE,"<p><strong><a href=""https://github.com/abiosoft/colima"">Colima</a></strong> is becoming a popular open alternative to Docker for Desktop. It provisions the Docker container runtime in a Lima VM, configures the Docker CLI on macOS and handles port-forwarding and volume mounts. Colima uses <a href=""https://containerd.io/"">containerd</a> as runtime, which is also the runtime on most managed Kubernetes services (thus improved dev-prod parity). With Colima you can easily use and test the latest features of containerd, such as lazy loading for container images. With its good performance, we're watching Colima as a strong potential for the open-source choice alternative to Docker for Desktop.</p>"
Collibra,Assess,Platforms,TRUE,"<p>In the increasingly crowded space that is the enterprise data catalog market, our teams have enjoyed working with <strong><a href=""https://www.collibra.com/us/en"">Collibra</a></strong>. They liked the deployment flexibility of either a SaaS or self-hosted instance, the wide range of functionality included out of the box, including data governance, lineage, quality and observability. Users also have the option to use a smaller subset of capabilities required by a more decentralized approach such as a <a href=""/radar/techniques/data-mesh"">data mesh</a>. The real feather in its cap has been their often overlooked customer support, which our people have found to be collaborative and supportive. Of course, there's a tension between simple data catalogs and more full featured enterprise platforms, but so far the teams using it are happy with how Collibra has supported their needs.</p>"
CycloneDX,Assess,Platforms,TRUE,"<p><strong><a href=""https://cyclonedx.org/"">CycloneDX</a></strong> is a standard for describing a machine-readable <a href=""/radar/techniques/software-bill-of-materials"">Software Bill of Materials</a> (SBOM). As software and compute fabrics increase in complexity, <em>software</em> becomes harder to define. Originating with OWASP, CycloneDX improves on the older SPDX standard with a broader definition that extends beyond the local machine dependencies to include runtime service dependencies. You'll also find implementations in several languages, an <a href=""https://cyclonedx.org/tool-center/"">ecosystem</a> of supporting integrations and a <a href=""https://github.com/CycloneDX/cyclonedx-cli"">CLI tool</a> that lets you analyze and change SBOMs with appropriate signing and verification.</p>"
Embeddinghub,Assess,Platforms,TRUE,"<p><strong><a href=""https://github.com/featureform/embeddinghub"">Embeddinghub</a></strong> is a vector database for machine-learning <a href=""https://www.featureform.com/post/the-definitive-guide-to-embeddings"">embeddings</a>, and quite similar to <a href=""/radar/platforms/milvus-2-0"">Milvus</a>. However, with out-of-the-box support for approximate nearest neighbor operations, partitioning, versioning and access control, we recommend you assess Embeddinghub for your embedding vector use cases.</p>"
Temporal,Assess,Platforms,TRUE,"<p><strong><a href=""https://temporal.io/"">Temporal</a></strong> is a platform for developing long-running workflows, particularly for microservice architectures. A fork of Uber’s previous OSS <a href=""https://github.com/uber/cadence"">Cadence</a> project, it has an event-sourcing model for long-running workflows so they can survive process/machine crashes. Although we don’t recommend using distributed transactions in microservice architectures, if you do need to implement them or long-running <a href=""https://microservices.io/patterns/data/saga.html"">Sagas</a>, you may want to look at Temporal.</p>"
tfsec,Adopt,Tools,FALSE,"<p>For our projects using <a href=""/radar/tools/terraform"">Terraform</a>, <strong><a href=""https://github.com/liamg/tfsec"">tfsec</a></strong> has quickly become a default static analysis tool to detect potential security risks. It's easy to integrate into a CI pipeline and has a growing library of checks against all of the major cloud providers and platforms like Kubernetes. Given its ease of use, we believe tfsec could be a good addition to any Terraform project.</p>"
AKHQ,Trial,Tools,TRUE,"<p><strong><a href=""https://akhq.io/docs/#installation"">AKHQ</a></strong> is a GUI for Apache Kafka that lets you manage topics, topics data, consumer groups and more. Some of our teams have found AKHQ to be an effective tool to watch the real-time status of a Kafka cluster. You can, for example, browse the topics on a cluster. For each topic, you can visualize the name, the number of messages stored, the disk size used, the time of the last record, the number of partitions, the replication factor with the in-sync quantity and the consumer group. With options for Avro and Protobuf deserialization, AKHQ can help you understand the flow of data in your Kafka environment.</p>"
cert-manager,Trial,Tools,FALSE,"<p><strong><a href=""https://cert-manager.io/"">cert-manager</a></strong> is a tool to manage your X.509 certificates within your <a href=""/radar/platforms/kubernetes"">Kubernetes</a> cluster. It models certificates and issuers as first-class resource types and provides certificates as a service securely to developers and applications working within the Kubernetes cluster. The obvious choice when using the Kubernetes default ingress controller, it's also recommended for others and much preferred over hand-rolling your own certificate management. Several of our teams have been using cert-manager extensively, and we've also found that its usability has much improved in the past few months.</p>"
